{
  "account_alias": "codex-active-auth",
  "changed_files": [
    "docs/plans/agent-continuity-and-shared-context-plan.md",
    "docs/backlog/issue-ready-backlog.md",
    "packages/contracts/src/governed_ai_coding_runtime_contracts/agent_continuity.py",
    "packages/agent-runtime/service_facade.py",
    "apps/control-plane/routes/operator.py",
    "scripts/agent-continuity.py",
    "scripts/serve-operator-ui.py",
    "tests/runtime/test_agent_continuity.py",
    "tests/runtime/test_operator_ui.py",
    "tests/service/test_operator_api.py"
  ],
  "continuity_class": "portable_shared",
  "created_at": "2026-05-10T05:20:00Z",
  "decisions": [
    {
      "evidence_ref": "docs/change-evidence/2026-05-10-agent-continuity-planning.md",
      "summary": "Native vendor history stores remain host-owned; cross-host continuity uses classified portable records."
    },
    {
      "evidence_ref": "docs/change-evidence/2026-05-10-agent-continuity-operator-surface.md",
      "summary": "Operator UI and local API expose searchable continuity posture without showing credentials."
    }
  ],
  "evidence_refs": [
    {
      "kind": "file",
      "ref": "docs/change-evidence/2026-05-10-agent-continuity-auditor.md",
      "summary": "Read-only host posture evidence"
    },
    {
      "kind": "file",
      "ref": "docs/change-evidence/2026-05-10-agent-continuity-index.md",
      "summary": "Portable index evidence"
    },
    {
      "kind": "file",
      "ref": "docs/change-evidence/2026-05-10-agent-continuity-operator-surface.md",
      "summary": "Operator surface and browser evidence"
    }
  ],
  "handoff_refs": [
    {
      "kind": "file",
      "ref": "docs/change-evidence/2026-05-10-agent-continuity-handoff-record.json",
      "summary": "Codex-to-Claude-to-Codex portable handoff record"
    }
  ],
  "memory_refs": [],
  "native_refs": [
    {
      "kind": "transcript",
      "owner": "codex",
      "ref": "C:\\Users\\sciman\\.codex\\sessions",
      "storage_policy": "referenced_only"
    },
    {
      "kind": "transcript",
      "owner": "claude",
      "ref": "C:\\Users\\sciman\\.claude\\projects",
      "storage_policy": "referenced_only"
    }
  ],
  "next_actions": [
    "Use the continuity search surface to resume GAP-164 follow-up from Codex, Claude Code, or the operator UI.",
    "Keep Claude Desktop native chat history as referenced_only unless an explicit supported export/transfer path is provided."
  ],
  "provider_alias": "openai",
  "record_id": "agent-continuity-gap-159-164-handoff",
  "repo_ref": {
    "path": "D:\\CODE\\governed-ai-coding-runtime",
    "repo_id": "governed-ai-coding-runtime"
  },
  "retention": {
    "audit_history_preserved": true,
    "expires_at": "2026-08-08T05:20:00Z",
    "retirement_policy": "Refresh after continuity operator/API behavior changes or after provider/account boundary changes."
  },
  "rollback_ref": "Remove this record from the runtime continuity index and revert this evidence file with git.",
  "sensitivity": {
    "contains_secret_material": false,
    "cross_account_injection": "requires_explicit_request",
    "level": "private",
    "redaction_status": "not_needed"
  },
  "surface": "operator",
  "task_summary": "Portable handoff for the cross-host agent continuity implementation queue GAP-159 through GAP-164.",
  "tool_family": "codex",
  "updated_at": "2026-05-10T05:20:00Z"
}
